{
  "$schema": "https://json-schema.org/draft/2020-12/schema",
  "$id": "agent-workflow/schemas/workflow_event.schema.json",
  "title": "WorkflowEvent",
  "description": "Durable event sourcing schema for agent_workflow lifecycle events. Append-only process truth for workflow orchestration.",
  "type": "object",
  "required": [
    "schema_version",
    "event_id",
    "workflow_run_id",
    "work_item_id",
    "event_type",
    "sequence",
    "timestamp",
    "actor",
    "run_id",
    "phase",
    "state",
    "attempt",
    "payload"
  ],
  "properties": {
    "schema_version": {
      "type": "integer",
      "const": 1,
      "description": "Schema version for forward compatibility."
    },
    "event_id": {
      "type": "string",
      "pattern": "^evt_",
      "description": "Globally unique event identifier, prefixed with 'evt_'."
    },
    "workflow_run_id": {
      "type": "string",
      "pattern": "^wfr_",
      "description": "Parent workflow run identifier, prefixed with 'wfr_'."
    },
    "work_item_id": {
      "type": "string",
      "description": "Identifier of the work item this event belongs to."
    },
    "event_type": {
      "type": "string",
      "enum": [
        "WORKFLOW_CREATED",
        "WORK_ITEM_CREATED",
        "PHASE_STARTED",
        "PHASE_COMPLETED",
        "APPROVAL_REQUESTED",
        "APPROVAL_GRANTED",
        "APPROVAL_REJECTED",
        "RETRY_STARTED",
        "CANCELLED",
        "RESUMED",
        "ARTIFACT_PROMOTED",
        "CHECKPOINT_WRITTEN"
      ],
      "description": "Minimum durable event types for lifecycle tracking."
    },
    "sequence": {
      "type": "integer",
      "minimum": 0,
      "description": "Authoritative replay order. Monotonically increasing within a workflow_run_id."
    },
    "timestamp": {
      "type": "string",
      "format": "date-time",
      "pattern": "^\\d{4}-\\d{2}-\\d{2}T\\d{2}:\\d{2}:\\d{2}[+-]\\d{2}:\\d{2}$",
      "description": "ISO 8601 timestamp with timezone offset. Audit metadata, not the only ordering source."
    },
    "actor": {
      "type": "string",
      "description": "Identifies actor type (e.g. 'agent:claude', 'agent:codex', 'human', 'system')."
    },
    "run_id": {
      "type": "string",
      "description": "Unique run identifier distinguishing parallel same-type agent invocations."
    },
    "agent_instance_id": {
      "type": ["string", "null"],
      "description": "Optional agent instance identifier for tracing specific agent sessions."
    },
    "correlation_id": {
      "type": ["string", "null"],
      "description": "Optional identifier linking causally related cross-item events."
    },
    "phase": {
      "type": "string",
      "description": "Pack-registered phase string (e.g. SCAFFOLD, PLAN, REVIEW, REVISE, EXECUTE, CODE_AUDIT, FINAL_AUDIT). Core does not hardcode phase values."
    },
    "phase_category": {
      "type": ["string", "null"],
      "description": "Optional common category for cross-pack queries (e.g. PLAN, REVIEW, EXECUTE, AUDIT, FINAL)."
    },
    "sub_phase": {
      "type": ["string", "null"],
      "description": "Optional pack-local recovery/query detail (e.g. scaffold, code_audit, final_audit)."
    },
    "state": {
      "type": "string",
      "enum": [
        "PENDING",
        "RUNNING",
        "WAITING_APPROVAL",
        "FAILED",
        "COMPLETED",
        "CANCELLED"
      ],
      "description": "Core closed enum for work item lifecycle state."
    },
    "attempt": {
      "type": "integer",
      "minimum": 1,
      "description": "Attempt number, starting at 1. Incremented on retry."
    },
    "payload": {
      "type": "object",
      "description": "Event-type-specific payload. Must be JSON-serializable. Some event types have required payload fields."
    }
  },
  "allOf": [
    {
      "if": {
        "properties": { "event_type": { "const": "ARTIFACT_PROMOTED" } }
      },
      "then": {
        "properties": {
          "payload": {
            "type": "object",
            "required": ["artifact_id", "artifact_path", "sha256"],
            "properties": {
              "artifact_id": { "type": "string" },
              "artifact_path": { "type": "string" },
              "sha256": { "type": "string", "pattern": "^[a-f0-9]{64}$" }
            }
          }
        }
      }
    },
    {
      "if": {
        "properties": { "event_type": { "const": "CHECKPOINT_WRITTEN" } }
      },
      "then": {
        "properties": {
          "payload": {
            "type": "object",
            "required": ["checkpoint_id"],
            "properties": {
              "checkpoint_id": { "type": "string", "pattern": "^ckpt_" }
            }
          }
        }
      }
    },
    {
      "if": {
        "properties": { "event_type": { "const": "WORKFLOW_CREATED" } }
      },
      "then": {
        "properties": {
          "payload": {
            "type": "object",
            "required": ["strategy", "topic"],
            "properties": {
              "strategy": { "type": "string" },
              "topic": { "type": "string" }
            }
          }
        }
      }
    },
    {
      "if": {
        "properties": { "event_type": { "const": "PHASE_COMPLETED" } }
      },
      "then": {
        "properties": {
          "payload": {
            "type": "object",
            "required": ["phase", "artifacts"],
            "properties": {
              "phase": { "type": "string" },
              "artifacts": { "type": "array", "items": { "type": "string" } }
            }
          }
        }
      }
    }
  ]
}
