{
  "schema_version": 1,
  "event_id": "evt_checkpoint_written_001",
  "workflow_run_id": "wfr_test_001",
  "work_item_id": "step2",
  "event_type": "CHECKPOINT_WRITTEN",
  "sequence": 16,
  "timestamp": "2026-06-08T12:01:00+08:00",
  "actor": "system",
  "run_id": "run_test_001",
  "phase": "REVIEW",
  "phase_category": "REVIEW",
  "state": "COMPLETED",
  "attempt": 1,
  "payload": {
    "checkpoint_id": "ckpt_review_completed_001"
  }
}
