{
  "schema_version": 1,
  "event_id": "evt_phase_completed_001",
  "workflow_run_id": "wfr_test_001",
  "work_item_id": "step2",
  "event_type": "PHASE_COMPLETED",
  "sequence": 15,
  "timestamp": "2026-06-08T12:00:00+08:00",
  "actor": "agent:claude",
  "run_id": "run_test_001",
  "agent_instance_id": "agent_inst_abc123",
  "correlation_id": "corr_xyz789",
  "phase": "REVIEW",
  "phase_category": "REVIEW",
  "sub_phase": null,
  "state": "COMPLETED",
  "attempt": 1,
  "payload": {
    "phase": "REVIEW",
    "artifacts": [
      "strategy_system_workflow_v1.step2.plan-review.v1"
    ]
  }
}
